{
  "$schema": "../walkthrough.schema.json",
  "id": "the-legend-of-heroes-trails-of-cold-steel-ii-main",
  "game": "The Legend of Heroes: Trails of Cold Steel II",
  "title": "Main Story Walkthrough",
  "author": "Neoseeker",
  "source_url": "https://www.neoseeker.com/the-legend-of-heroes-trails-of-cold-steel-ii/walkthrough",
  "attribution": "This walkthrough was pulled from Neoseeker (https://www.neoseeker.com/the-legend-of-heroes-trails-of-cold-steel-ii/walkthrough) and processed for a cleaner reading experience. All credit for the original content goes to Neoseeker.",
  "created_at": "2026-05-01",
  "sections": [
    {
      "id": "prologue-part-a",
      "title": "Prologue Part A: Eisengard Mountain Range (November 29)",
      "content": "## Prologue Part A: Eisengard Mountain Range\n\nThe game opens one month after the devastating events that concluded Trails of Cold Steel. Rean Schwarzer awakens alone in the frozen Eisengard Mountain Range with no memory of how he arrived. The snowy peaks stretch endlessly, and the only path leads downhill through a narrow canyon filled with monsters.\n\n### Game Start & New Game Bonuses\n\nBegin a new game and select your preferred difficulty setting. If you possess clear save data from the first Trails of Cold Steel, you can import it for substantial bonuses including extra Sepith, bonus items, additional S-Craft attacks, and stat boosts depending on Rean's final level and academic rank from the previous game. Platinum trophy hunters should note that at least two full playthroughs are required.\n\nThe introduction sequence provides a dramatic recap of the climax of the first game — the Noble Alliance's coup d'état, the awakening of the Vermillion Apocalypse, and Rean's desperate activation of Valimar the Ashen Knight. Be warned that this contains major spoilers for the first game's ending.\n\n<!-- checkpoint: prologue-a-start | Gained control of Rean -->\n\n### First Steps in Eisengard\n\nAfter gaining control of Rean, the game introduces the **Save System** and **Navigation Menu** (press Square/touchpad to see your current objective). Head downhill along the snowy path. You'll spot a glowing object on the ground — examine it to recover Rean's tachi sword and basic equipment.\n\nOpen the main menu and navigate to the **Orbment** screen. Equip your **Master Quartz** (likely Force or Domination depending on your import). The Master Quartz system provides passive bonuses and levels up as you gain AP in battle, unlocking new Arts at higher levels.\n\n### Combat Tutorial & Monster Notes\n\nContinue downhill until you encounter your first monster — a **Helm Scorpion**. The game teaches you the pre-emptive strike system: approach enemies from behind or stun them with a field attack (Circle button) to gain advantages in battle including bonus turns, reduced enemy HP, and favorable positioning.\n\nAfter your first victory, the **Monster Notes** system is introduced. Every unique enemy you defeat or analyze fills out your bestiary, which contributes to your overall completion rating. Make it a habit to analyze every new enemy type you encounter.\n\n<!-- checkpoint: prologue-a-combat | Completed first battle -->\n\n### Eisengard Mountain Path\n\nProceed through **Eisengard Range - Map 2**. Shortly after entering, you'll find your first treasure chest containing a **Tear Quartz** (heals HP in battle). Continue east, fighting groups of Helm Scorpions, Rolling Stones (boulder-type enemies weak to Wind arts), and Sky Gazers (flying enemies weak to Time arts).\n\nExplore any branching paths for additional treasure chests containing Sepith and healing items. The monsters here provide good early experience and help you refamiliarize yourself with the combat system's mechanics including turn bonuses, S-Craft timing, and the AT (Action Time) bar.\n\n<!-- checkpoint: prologue-a-boss | Reached Magic Knight Ortheim -->\n\n### Boss: Magic Knight Ortheim\n\nAt the end of the canyon, you'll encounter the imposing **Magic Knight Ortheim** — a massive arcane construct blocking your path. This is a scripted encounter designed to introduce boss mechanics.\n\n**Strategy:** Simply attack the Magic Knight and deal as much damage as possible. The fight ends automatically once its HP drops to approximately 50% (around 10,000 HP). Use Rean's crafts — **Arc Slash** for reliable damage and **Motivate** if you need healing. Don't worry about running out of resources; the scene triggers regardless of your performance.\n\nAfter dealing sufficient damage, a dramatic cutscene plays where **Toval Randonneur** (a Bracer from the first game), **Princess Alfin**, and **Elise Schwarzer** arrive to rescue Rean. The group defeats Ortheim together and makes their escape from the mountains, eventually arriving at the village of Ymir.",
      "checkpoints": [
        { "id": "prologue-a-start", "label": "Gained control of Rean" },
        { "id": "prologue-a-combat", "label": "Completed first battle" },
        { "id": "prologue-a-boss", "label": "Reached Magic Knight Ortheim" }
      ],
      "steps": [
        {
          "id": "pro-a-001",
          "type": "note",
          "text": "Begin a new game and select your difficulty. If you have clear save data from the first game, you can transfer it for bonuses (extra Sepith, items, and attacks depending on Rean's level and rank)."
        },
        {
          "id": "pro-a-002",
          "type": "step",
          "text": "Watch the introduction sequence which recaps the end of the first game.",
          "note": "Contains spoilers for the first game."
        },
        {
          "id": "pro-a-003",
          "type": "step",
          "text": "After gaining control of Rean, open the navigation menu (Square button) to see your next objective."
        },
        {
          "id": "pro-a-004",
          "type": "step",
          "text": "Head downhill and check the shining object to obtain Rean's equipment."
        },
        {
          "id": "pro-a-005",
          "type": "step",
          "text": "Open the menu and equip your **Master Quartz** in the Orbment system."
        },
        {
          "id": "pro-a-006",
          "type": "step",
          "text": "Encounter and fight your first monster. Sneak up on enemies or stun them to gain a battle advantage (bonus turns, reduced enemy HP).",
          "note": "After your victory, the Monster Notes system is introduced — defeating monsters fills out your enemy database."
        },
        {
          "id": "pro-a-007",
          "type": "step",
          "text": "Proceed down the canyon, fighting enemies including Helm Scorpions, Rolling Stones, and Sky Gazers. Check side paths for treasure chests."
        },
        {
          "id": "pro-a-008",
          "type": "collectible",
          "text": "Treasure chest in Eisengard Range Map 2 contains a **Tear Quartz**.",
          "note": "Found shortly after entering the second map area."
        },
        {
          "id": "pro-a-009",
          "type": "boss",
          "text": "**BOSS: Magic Knight Ortheim** — Keep attacking until its HP drops to approximately 50% (~10,000 HP), ending the fight automatically.",
          "note": "This is a scripted battle; just keep dealing damage until the scene triggers. Use Arc Slash and Motivate as needed."
        }
      ]
    },
    {
      "id": "prologue-part-b",
      "title": "Prologue Part B: Ymir Village & Canyon (November 30)",